{
  "external_id": "br_tiein_credit",
  "kind": "branch_retail",
  "branch_code": "VSP-0315",
  "employee_public_id": null,
  "desk_no": 4,
  "client": null,
  "deal_product": "Потребительский кредит",
  "started_at": "2026-11-09T11:05:00+03:00",
  "geo": {
    "region_code": null,
    "city_id": null,
    "lat": null,
    "lon": null,
    "source": "contact"
  },
  "analyses": [
    "client_signal",
    "employee_quality"
  ],
  "turns": [
    {
      "seq": 1,
      "speaker": "employee",
      "text": "Здравствуйте, меня зовут Сергей, чем могу помочь?",
      "t0_ms": 0,
      "t1_ms": 3840
    },
    {
      "seq": 2,
      "speaker": "client",
      "text": "Интересует потребительский кредит на триста тысяч.",
      "t0_ms": 4240,
      "t1_ms": 8140
    },
    {
      "seq": 3,
      "speaker": "employee",
      "text": "Назовите, пожалуйста, фамилию и покажите документ.",
      "t0_ms": 8540,
      "t1_ms": 12440
    },
    {
      "seq": 4,
      "speaker": "client",
      "text": "Да, пожалуйста.",
      "t0_ms": 12840,
      "t1_ms": 14640
    },
    {
      "seq": 5,
      "speaker": "employee",
      "text": "Уточню: вам важнее доходность или возможность снять деньги в любой момент?",
      "t0_ms": 15040,
      "t1_ms": 20380
    },
    {
      "seq": 6,
      "speaker": "client",
      "text": "Хочу разместить свободные деньги на полгода.",
      "t0_ms": 20780,
      "t1_ms": 24320
    },
    {
      "seq": 7,
      "speaker": "employee",
      "text": "Ставка по кредиту девятнадцать и девять десятых процента. Страховка добровольная: с ней ставка ниже на два пункта, но решение за вами.",
      "t0_ms": 24720,
      "t1_ms": 33660
    },
    {
      "seq": 8,
      "speaker": "client",
      "text": "А если закрыть раньше срока?",
      "t0_ms": 34060,
      "t1_ms": 36640
    },
    {
      "seq": 9,
      "speaker": "employee",
      "text": "Карту выдадим, только если оформите подписку.",
      "t0_ms": 37040,
      "t1_ms": 40640
    },
    {
      "seq": 10,
      "speaker": "client",
      "text": "Ладно.",
      "t0_ms": 41040,
      "t1_ms": 42300
    },
    {
      "seq": 11,
      "speaker": "employee",
      "text": "Подведу итог: кредит триста тысяч на три года, страховка по желанию. Следующий шаг — подписание договора, я распечатаю.",
      "t0_ms": 42700,
      "t1_ms": 50740
    },
    {
      "seq": 12,
      "speaker": "employee",
      "text": "Спасибо, что обратились! Всего доброго.",
      "t0_ms": 51140,
      "t1_ms": 54380
    }
  ],
  "meta": {
    "employee_display_name": null,
    "branch_city": "Казань",
    "synthetic": true
  }
}
