{
  "external_id": "cc_chat_conceal",
  "kind": "contact_center_chat",
  "branch_code": null,
  "employee_public_id": null,
  "desk_no": null,
  "client": null,
  "deal_product": "Вклад «Накопительный»",
  "started_at": "2026-11-09T11:05:00+03:00",
  "geo": null,
  "analyses": [
    "client_signal",
    "employee_quality"
  ],
  "turns": [
    {
      "seq": 1,
      "speaker": "employee",
      "text": "Банк, меня зовут Мария, здравствуйте.",
      "t0_ms": 0,
      "t1_ms": 3120
    },
    {
      "seq": 2,
      "speaker": "client",
      "text": "Хочу открыть вклад, какая сейчас ставка?",
      "t0_ms": 3520,
      "t1_ms": 6820
    },
    {
      "seq": 3,
      "speaker": "employee",
      "text": "Назовите, пожалуйста, кодовое слово и дату рождения.",
      "t0_ms": 7220,
      "t1_ms": 11240
    },
    {
      "seq": 4,
      "speaker": "client",
      "text": "Кодовое слово «Ромашка», двенадцатое марта.",
      "t0_ms": 11640,
      "t1_ms": 15120
    },
    {
      "seq": 5,
      "speaker": "employee",
      "text": "Расскажите, какая у вас задача — накопить, разместить свободные деньги или что-то другое?",
      "t0_ms": 15520,
      "t1_ms": 21760
    },
    {
      "seq": 6,
      "speaker": "client",
      "text": "Чтобы без комиссий и просто.",
      "t0_ms": 22160,
      "t1_ms": 24740
    },
    {
      "seq": 7,
      "speaker": "employee",
      "text": "По вкладу «Накопительный» ставка девять с половиной процентов годовых на шесть месяцев, пополнение разрешено, досрочное закрытие — по ставке до востребования. Обратите внимание на этот пункт договора.",
      "t0_ms": 25140,
      "t1_ms": 38040
    },
    {
      "seq": 8,
      "speaker": "client",
      "text": "А комиссии какие-то есть?",
      "t0_ms": 38440,
      "t1_ms": 40840
    },
    {
      "seq": 9,
      "speaker": "employee",
      "text": "Подпишите, это формальность, условия стандартные, читать не обязательно.",
      "t0_ms": 41240,
      "t1_ms": 46460
    },
    {
      "seq": 10,
      "speaker": "client",
      "text": "А это точно так?",
      "t0_ms": 46860,
      "t1_ms": 48720
    },
    {
      "seq": 11,
      "speaker": "employee",
      "text": "Подведу итог: вклад на шесть месяцев, ставка девять с половиной, с пополнением. Следующий шаг — подписание договора, я распечатаю.",
      "t0_ms": 49120,
      "t1_ms": 57820
    },
    {
      "seq": 12,
      "speaker": "employee",
      "text": "Хорошего дня, обращайтесь.",
      "t0_ms": 58220,
      "t1_ms": 60680
    }
  ],
  "meta": {
    "employee_display_name": null,
    "branch_city": null,
    "synthetic": true
  }
}
