{
  "external_id": "br_clean_deposit",
  "kind": "branch_retail",
  "branch_code": "VSP-0107",
  "employee_public_id": null,
  "desk_no": 1,
  "client": null,
  "deal_product": "Вклад «Накопительный»",
  "started_at": "2026-11-09T11:05:00+03:00",
  "geo": {
    "region_code": null,
    "city_id": null,
    "lat": null,
    "lon": null,
    "source": "contact"
  },
  "analyses": [
    "client_signal",
    "employee_quality"
  ],
  "turns": [
    {
      "seq": 1,
      "speaker": "employee",
      "text": "Здравствуйте, меня зовут Анна, чем могу помочь?",
      "t0_ms": 0,
      "t1_ms": 3720
    },
    {
      "seq": 2,
      "speaker": "client",
      "text": "Хочу открыть вклад, какая сейчас ставка?",
      "t0_ms": 4120,
      "t1_ms": 7420
    },
    {
      "seq": 3,
      "speaker": "employee",
      "text": "Паспорт, пожалуйста, для идентификации.",
      "t0_ms": 7820,
      "t1_ms": 11060
    },
    {
      "seq": 4,
      "speaker": "client",
      "text": "Да, пожалуйста.",
      "t0_ms": 11460,
      "t1_ms": 13260
    },
    {
      "seq": 5,
      "speaker": "employee",
      "text": "Чем могу помочь? Что вас интересует в первую очередь?",
      "t0_ms": 13660,
      "t1_ms": 17740
    },
    {
      "seq": 6,
      "speaker": "client",
      "text": "Важнее доходность.",
      "t0_ms": 18140,
      "t1_ms": 20120
    },
    {
      "seq": 7,
      "speaker": "employee",
      "text": "По вкладу «Накопительный» ставка девять с половиной процентов годовых на шесть месяцев, пополнение разрешено, досрочное закрытие — по ставке до востребования. Обратите внимание на этот пункт договора.",
      "t0_ms": 20520,
      "t1_ms": 33420
    },
    {
      "seq": 8,
      "speaker": "client",
      "text": "А если закрыть раньше срока?",
      "t0_ms": 33820,
      "t1_ms": 36400
    },
    {
      "seq": 9,
      "speaker": "employee",
      "text": "Досрочное закрытие — по ставке до востребования, комиссий нет. Можете взять договор домой и вернуться завтра.",
      "t0_ms": 36800,
      "t1_ms": 44240
    },
    {
      "seq": 10,
      "speaker": "client",
      "text": "Да, подходит.",
      "t0_ms": 44640,
      "t1_ms": 46320
    },
    {
      "seq": 11,
      "speaker": "employee",
      "text": "Подведу итог: вклад на шесть месяцев, ставка девять с половиной, с пополнением. Следующий шаг — подписание договора, я распечатаю.",
      "t0_ms": 46720,
      "t1_ms": 55420
    },
    {
      "seq": 12,
      "speaker": "employee",
      "text": "Спасибо, что обратились! Всего доброго.",
      "t0_ms": 55820,
      "t1_ms": 59060
    }
  ],
  "meta": {
    "employee_display_name": null,
    "branch_city": "Москва",
    "synthetic": true
  }
}
