{
  "external_id": "scenario09_isj",
  "kind": "branch_retail",
  "branch_code": "VSP-0042",
  "employee_public_id": null,
  "desk_no": 3,
  "client": null,
  "deal_product": "Вклад «Накопительный»",
  "started_at": "2026-11-09T11:05:00+03:00",
  "geo": {
    "region_code": null,
    "city_id": null,
    "lat": null,
    "lon": null,
    "source": "contact"
  },
  "analyses": [
    "client_signal",
    "employee_quality"
  ],
  "turns": [
    {
      "seq": 1,
      "speaker": "employee",
      "text": "Здравствуйте, меня зовут Петров, чем могу помочь?",
      "t0_ms": 0,
      "t1_ms": 3840
    },
    {
      "seq": 2,
      "speaker": "client",
      "text": "Хочу открыть вклад, какая сейчас ставка?",
      "t0_ms": 4240,
      "t1_ms": 7540
    },
    {
      "seq": 3,
      "speaker": "employee",
      "text": "Паспорт, пожалуйста, для идентификации.",
      "t0_ms": 7940,
      "t1_ms": 11180
    },
    {
      "seq": 4,
      "speaker": "client",
      "text": "Да, пожалуйста.",
      "t0_ms": 11580,
      "t1_ms": 13380
    },
    {
      "seq": 5,
      "speaker": "employee",
      "text": "Чем могу помочь? Что вас интересует в первую очередь?",
      "t0_ms": 13780,
      "t1_ms": 17860
    },
    {
      "seq": 6,
      "speaker": "client",
      "text": "Хочу разместить свободные деньги на полгода.",
      "t0_ms": 18260,
      "t1_ms": 21800
    },
    {
      "seq": 7,
      "speaker": "employee",
      "text": "По вкладу «Накопительный» ставка девять с половиной процентов годовых на шесть месяцев, пополнение разрешено, досрочное закрытие — по ставке до востребования. Обратите внимание на этот пункт договора.",
      "t0_ms": 22200,
      "t1_ms": 35100
    },
    {
      "seq": 8,
      "speaker": "client",
      "text": "Это точно без скрытых условий?",
      "t0_ms": 35500,
      "t1_ms": 38200
    },
    {
      "seq": 9,
      "speaker": "employee",
      "text": "Это как вклад, только лучше — по сути тот же депозит, но доходнее.",
      "t0_ms": 38600,
      "t1_ms": 43460
    },
    {
      "seq": 10,
      "speaker": "client",
      "text": "Ладно.",
      "t0_ms": 43860,
      "t1_ms": 45120
    },
    {
      "seq": 11,
      "speaker": "employee",
      "text": "Подпишите, это формальность, условия стандартные, читать не обязательно.",
      "t0_ms": 45520,
      "t1_ms": 50740
    },
    {
      "seq": 12,
      "speaker": "client",
      "text": "Хм, ну если вы так говорите…",
      "t0_ms": 51140,
      "t1_ms": 53720
    },
    {
      "seq": 13,
      "speaker": "employee",
      "text": "Без страховки кредит вам не одобрят, это условие.",
      "t0_ms": 54120,
      "t1_ms": 57960
    },
    {
      "seq": 14,
      "speaker": "client",
      "text": "А это точно так?",
      "t0_ms": 58360,
      "t1_ms": 60220
    },
    {
      "seq": 15,
      "speaker": "employee",
      "text": "Хорошего дня, обращайтесь.",
      "t0_ms": 60620,
      "t1_ms": 63080
    }
  ],
  "meta": {
    "employee_display_name": "Петров П. П.",
    "branch_city": "Самара",
    "synthetic": true
  }
}
